,index,Borough,date_listed,agency_name,chain_free,address,isRetirementHome,isSharedOwnership,listingCondition,price,propertyType,isAuction,tenure,title,latitude,longitude,floor_area_msq,numBedrooms,numBathrooms,numLivingRooms,firstPublishedDate,firstPublishedPrice,balcony_terrace,parking,garden,closest_station_name,closest_station_distance_sec,pub_restaurant
3449,3449,Islington,2021-02-10,Yopa,0,"Cynthia Street, London N1",0,1,pre-owned,185000.0,flat,0,Other,1 bed flat for sale,51.531709,-0.113235,55.0,1,1,1,2021-02-10,190000.0,1,0,1,Angel,457,68
3450,3450,Islington,2021-02-10,Property Inside London,1,"Rectangular Building, City North, Finsbury Park, London N4",0,0,new,820000.0,flat,0,leasehold,2 bed flat for sale,51.564344,-0.107734,83.0,2,2,1,2021-02-10,820000.0,1,0,1,Finsbury Park,305,35
3451,3451,Islington,2021-02-09,Knight Frank - Islington Sales,1,"Chapel Market, London N1",0,0,new,785000.0,flat,0,leasehold,2 bed flat for sale,51.533578,-0.108313,78.0,2,2,1,2021-02-09,825000.0,0,0,0,Angel,344,93
3452,3452,Islington,2021-02-09,Knight Frank - Islington Sales,1,"Ecclesbourne Road, London N1",0,0,pre-owned,750000.0,semi_detached,0,leasehold,2 bed semi-detached house for sale,51.5418,-0.090438,80.0,2,2,1,2021-02-09,850000.0,0,0,0,Highbury & Islington,1101,17
3453,3453,Islington,2021-02-09,Portico - Highbury,0,"Athelstane Mews, London N4",0,0,pre-owned,450000.0,flat,0,share_of_freehold,1 bed flat for sale,51.567963,-0.110361,44.0,1,0,0,2021-02-09,450000.0,0,0,0,Finsbury Park,446,41
3454,3454,Islington,2021-02-08,Scott City Residential,0,"Breton House, Barbican, London EC2Y",0,0,pre-owned,485000.0,studio,0,Other,Studio for sale,51.521331,-0.09381,41.0,0,0,0,2021-02-08,485000.0,1,0,0,Barbican,279,82
3455,3455,Islington,2021-02-08,London Move,1,"Canonbury Road, 22 Dixon Clark Court N1",0,0,pre-owned,390000.0,flat,0,leasehold,1 bed flat for sale,51.545662,-0.101492,50.0,1,1,1,2021-02-08,399500.0,1,0,0,Highbury & Islington,380,42
3456,3456,Islington,2021-02-07,Bachik Properties,1,"Upper Street, Islington, London N1",0,0,new,900000.0,flat,0,leasehold,2 bed flat for sale,51.539134,-0.102629,63.0,2,1,1,2021-02-07,900000.0,0,0,0,Highbury & Islington,576,102
3457,3457,Islington,2021-02-07,Just Us Global,0,"City Road, London EC1V",0,0,pre-owned,895700.0,flat,0,leasehold,1 bed flat for sale,51.528068,-0.095664,66.0,1,1,0,2021-02-07,995400.0,1,0,0,Chesham,520,44
3458,3458,Islington,2021-02-06,Nested Ltd,0,"Mortimer Road, De Beauvoir, London N1",0,0,pre-owned,1400000.0,terraced,0,freehold,3 bed terraced house for sale,51.539962,-0.080026,133.0,3,2,2,2021-02-06,1450000.0,0,0,1,Old Street,1465,25
3459,3459,Islington,2021-02-05,Reliable Homes,1,"Caledonian Road, London N1",0,0,pre-owned,150000.0,studio,0,Other,Studio for sale,51.539699,-0.116718,17.0,0,1,1,2021-02-05,150000.0,0,0,0,Caledonian Road,662,19
3460,3460,Islington,2021-02-05,Hunters - Shoreditch,0,"Enfield Road, London N1",0,0,pre-owned,550000.0,flat,0,Other,2 bed flat for sale,51.539722,-0.077412,72.0,2,0,0,2021-02-05,550000.0,0,0,0,Old Street,1582,23
3461,3461,Islington,2021-02-04,Hamptons - Islington Sales,1,"Northumberland House, Highbury Crescent, London N5",0,0,pre-owned,1250000.0,flat,0,leasehold,2 bed flat for sale,51.548931,-0.105033,97.0,2,2,1,2021-02-04,1400000.0,0,0,1,Highbury & Islington,608,45
3462,3462,Islington,2021-02-04,Savills - Clerkenwell,1,"Seward Street, Clerkenwell, London EC1V",0,0,pre-owned,699995.0,flat,0,leasehold,2 bed flat for sale,51.526404,-0.097853,63.0,2,1,1,2021-02-04,699995.0,1,0,0,Barbican,609,57
3463,3463,Islington,2021-02-04,Square Quarters,0,"Caledonian Road, Islington N1",0,0,pre-owned,549000.0,flat,0,leasehold,3 bed flat for sale,51.539232,-0.116526,73.0,3,1,1,2021-02-04,600000.0,0,0,1,Caledonian Road,699,21
3464,3464,Islington,2021-02-04,Savills - Islington,0,"St Pauls Road, Islington, London N1",0,0,pre-owned,1730000.0,terraced,0,freehold,4 bed terraced house for sale,51.547075,-0.089376,184.0,4,1,1,2021-02-04,1800000.0,0,0,1,Highbury & Islington,946,16
3465,3465,Islington,2021-02-03,Drivers & Norris,0,"Cornelia Street, Islington, London N7",0,0,pre-owned,350000.0,flat,0,Other,1 bed flat for sale,51.54461,-0.112878,48.0,1,1,1,2021-02-03,350000.0,0,0,0,Caledonian Road,424,22
3466,3466,Islington,2021-02-03,Frank Harris & Co.,1,"Cromwell Tower, Barbican, London EC2Y",0,0,pre-owned,1850000.0,flat,0,leasehold,2 bed flat for sale,51.520477,-0.092795,110.0,2,0,0,2021-02-03,1850000.0,1,0,0,Chesham,313,78
3467,3467,Islington,2021-02-03,Hamilton Brooks,0,"Golden Lane Estate, London EC1Y",0,0,pre-owned,425000.0,studio,0,leasehold,Studio for sale,51.5223,-0.097254,23226.0,0,1,1,2021-02-03,425000.0,1,0,1,Barbican,203,109
3468,3468,Islington,2021-02-03,Reliable Homes,1,"Caledonian Road, London N1",0,0,pre-owned,350000.0,flat,0,Other,1 bed flat for sale,51.538799,-0.116755,36.0,1,1,1,2021-02-03,360000.0,0,0,0,Caledonian Road,732,20
3469,3469,Islington,2021-01-26,Winkworth - Islington,1,"Ferntower Road, London N5",0,0,pre-owned,960000.0,terraced,0,share_of_freehold,3 bed terraced house for sale,51.551129,-0.088182,93.0,3,2,1,2021-01-26,1000000.0,0,0,1,Highbury & Islington,1221,17
3470,3470,Islington,2021-01-26,Hamptons - Hampstead Sales,1,"Charlton Kings Road, London NW5",0,0,pre-owned,1175000.0,end_terrace,0,freehold,2 bed end terrace house for sale,51.551328,-0.13204,101.0,2,0,0,2021-01-26,1250000.0,0,0,1,Chesham,557,8
3471,3471,Islington,2021-01-26,Thomas Michael,0,"Goswell Road, London EC1V",0,0,pre-owned,650000.0,flat,0,share_of_freehold,1 bed flat for sale,51.525368,-0.099395,89.0,1,1,1,2021-01-26,650000.0,0,1,1,Barbican,470,72
3472,3472,Islington,2021-01-22,David Andrew Estates,0,"Blackstock Road, London N5",0,0,pre-owned,400000.0,flat,0,Other,1 bed flat for sale,51.5592,-0.100042,42.0,1,1,1,2021-01-22,425000.0,0,0,0,Arsenal,561,19
3473,3473,Islington,2021-01-22,Savills - National Auctions,0,"White Lion Street, London N1",0,0,pre-owned,475000.0,block_of_flats,1,leasehold,5 bed block of flats for sale,51.532935,-0.108567,81.0,5,0,0,2021-01-22,475000.0,1,0,0,Angel,322,83
3474,3474,Islington,2021-01-21,Winkworth - Harringay,0,"Alexandra Grove, London N4",0,0,pre-owned,565000.0,flat,0,leasehold,2 bed flat for sale,51.567275,-0.097273,59.0,2,1,1,2021-01-21,585000.0,1,0,0,Manor House,410,4
3475,3475,Islington,2021-01-21,Winkworth - Highbury,0,"Alexandra Grove, Finsbury Park N4",0,0,pre-owned,565000.0,flat,0,Other,2 bed flat for sale,51.567275,-0.097273,59.0,2,1,1,2021-01-21,585000.0,1,0,0,Manor House,410,4
3476,3476,Islington,2021-01-21,JLL - City,1,"City Road, London EC1V",0,0,pre-owned,1400000.0,flat,0,leasehold,2 bed flat for sale,51.527671,-0.0884,103.0,2,2,1,2021-01-21,1400000.0,1,0,0,Old Street,167,72
3477,3477,Islington,2021-01-21,Property Inside London,0,"Canaletto, City Road, London EC1V",0,0,pre-owned,975000.0,flat,0,leasehold,2 bed flat for sale,51.529355,-0.095292,86.0,2,2,1,2021-01-21,975000.0,1,0,0,Old Street,505,32
3478,3478,Islington,2021-01-21,Property Inside London,1,"Canaletto, 257 City Road, London EC1V",0,0,pre-owned,720000.0,flat,0,leasehold,1 bed flat for sale,51.529333,-0.095335,53.0,1,1,1,2021-01-21,745000.0,1,0,0,Old Street,503,32
3479,3479,Islington,2021-01-20,Savills - Clerkenwell,0,"Dance Square, London EC1V",0,0,pre-owned,650000.0,flat,0,leasehold,1 bed flat for sale,51.525878,-0.097558,53.0,1,1,1,2021-01-20,650000.0,1,1,1,Barbican,578,64
3480,3480,Islington,2021-01-20,David Andrew Estates,1,"Wedmore Street, London N19",0,0,new,975000.0,terraced,0,Other,3 bed terraced house for sale,51.560544,-0.127915,103.0,3,2,0,2021-01-20,1000000.0,1,0,1,Chesham,662,22
3481,3481,Islington,2021-01-20,Burghleys,0,"Tabley Road, London N7",0,0,pre-owned,850000.0,flat,0,leasehold,3 bed flat for sale,51.556455,-0.123553,103.0,3,1,1,2021-01-20,875000.0,0,0,1,Chesham,825,18
3482,3482,Islington,2021-01-19,Fraser & Co - New Homes,1,"City Road, London EC1V",0,0,new,900000.0,flat,0,leasehold,2 bed flat for sale,51.529043,-0.096029,67.0,2,1,1,2021-01-19,1000000.0,1,0,1,Chesham,516,32
3483,3483,Islington,2021-01-19,David Andrew Estates,1,"Kingsdown Road, London N19",0,0,pre-owned,500000.0,flat,0,leasehold,2 bed flat for sale,51.562301,-0.12444,79.0,2,1,1,2021-01-19,525000.0,0,0,0,Archway,624,23
3484,3484,Islington,2021-01-18,Winkworth - Islington,0,"Queensland Road, London N7",0,0,pre-owned,600000.0,flat,0,leasehold,2 bed flat for sale,51.553493,-0.107513,83.0,2,2,0,2021-01-18,600000.0,1,1,1,Chesham,438,28
3485,3485,Islington,2021-01-18,Wilkinson Byrne,1,"Victoria Road, Stroud Green, London N4",0,0,pre-owned,650000.0,flat,0,Other,3 bed flat for sale,51.570098,-0.111129,93.0,3,2,1,2021-01-18,650000.0,0,0,0,Finsbury Park,629,35
3486,3486,Islington,2021-01-15,Bairstow Eves - Southgate Sales,1,"Crouch Hall Court, Sparsholt Road, London N19",0,0,pre-owned,415000.0,flat,0,leasehold,3 bed flat for sale,51.569308,-0.119655,72.0,3,1,1,2021-01-15,415000.0,1,1,0,Chesham,1027,16
3487,3487,Islington,2021-01-14,Savills - Margaret Street RDS,1,"City North, London N4",0,0,new,975000.0,flat,0,leasehold,3 bed flat for sale,51.563729,-0.107694,115.0,3,3,1,2021-01-14,975000.0,0,0,1,Finsbury Park,219,28
3488,3488,Islington,2021-01-12,Savills - Margaret Street RDS,1,"City North, London N4",0,0,new,837500.0,flat,0,leasehold,3 bed flat for sale,51.563729,-0.107694,91.0,3,2,1,2021-01-12,837500.0,0,0,1,Finsbury Park,219,28
3489,3489,Islington,2021-01-12,Savills - Margaret Street RDS,1,"City North, London N4",0,0,new,1600000.0,flat,0,leasehold,4 bed flat for sale,51.564777,-0.107419,218.0,4,3,1,2021-01-12,1600000.0,1,0,1,Finsbury Park,348,35
3490,3490,Islington,2021-01-12,Daniel Rose Residential Ltd,1,"Cowdenbeath Path, Islington N1",0,0,pre-owned,400000.0,flat,0,leasehold,1 bed flat for sale,51.538409,-0.117887,50.0,1,1,1,2021-01-12,400000.0,1,0,1,King's Cross St. Pancras,866,22
3491,3491,Islington,2021-01-12,Hurford Salvi Carr - Clerkenwell & City Sales,0,"Turnmill Street, Clerkenwell EC1M",0,0,pre-owned,550000.0,flat,0,leasehold,2 bed flat for sale,51.520875,-0.104555,52.0,2,1,1,2021-01-12,570000.0,0,0,0,Farringdon,132,138
3492,3492,Islington,2021-01-12,Hurford Salvi Carr - Islington & Shoreditch,0,"Wenlock Road, London N1",0,0,pre-owned,550000.0,flat,0,leasehold,1 bed flat for sale,51.530444,-0.093575,52.0,1,1,1,2021-01-12,550000.0,1,0,0,Old Street,527,33
3493,3493,Islington,2021-01-12,Hunter Realty,0,"Goodwin St, Finsbury Park, London N4",0,0,pre-owned,520000.0,flat,0,leasehold,1 bed flat for sale,51.564162,-0.107777,10.0,1,1,1,2021-01-12,520000.0,0,0,1,Finsbury Park,296,35
3494,3494,Islington,2021-01-11,JLL - City,0,"City Road, London EC1V",0,0,pre-owned,950000.0,flat,0,leasehold,2 bed flat for sale,51.529985,-0.0972968780487805,72.0,2,2,1,2021-01-11,950000.0,1,0,0,Angel,524,26
3495,3495,Islington,2021-01-11,The Modern House,0,"Camden Road, London N7",0,0,pre-owned,2395000.0,terraced,0,freehold,5 bed terraced house for sale,51.55272,-0.1241,423.0,5,6,0,2021-01-11,2395000.0,1,0,0,Caledonian Road,588,11
3496,3496,Islington,2021-01-09,Landmark London Asset Management,0,"Eagle Point, City Road, London EC1V",0,0,pre-owned,815000.0,flat,0,Other,2 bed flat for sale,51.524044,-0.087806,84.0,2,2,1,2021-01-09,815000.0,0,0,0,Old Street,300,108
3497,3497,Islington,2021-01-08,Chestertons - Islington,1,"Highbury Park, Highbury, London N5",0,0,pre-owned,599950.0,maisonette,0,leasehold,2 bed maisonette for sale,51.557629,-0.098051,98.0,2,2,1,2021-01-08,650000.0,0,0,0,Arsenal,537,23
3498,3498,Islington,2021-01-08,Property Inc,0,"Henfield Close, London N19",0,0,pre-owned,475000.0,maisonette,0,Other,3 bed maisonette for sale,51.567352,-0.13405,74.0,3,2,1,2021-01-08,475000.0,0,0,1,Archway,325,21
3499,3499,Islington,2021-01-07,Frank Harris & Co.,1,"Cromwell Tower, Barbican, London EC2Y",0,0,pre-owned,1450000.0,flat,0,leasehold,3 bed flat for sale,51.520477,-0.092795,104.0,3,1,2,2021-01-07,1550000.0,1,0,1,Chesham,313,78
3500,3500,Islington,2021-01-06,Drivers & Norris,0,"Penn Road, Islington, London N7",0,0,pre-owned,950000.0,maisonette,0,leasehold,3 bed maisonette for sale,51.553803,-0.119314,94.0,3,1,1,2021-01-06,950000.0,0,0,1,Caledonian Road,494,16
3501,3501,Islington,2021-01-05,Knight Frank - Canary Wharf Sales,0,"The Factory, 1 Nile Street, London N1.",0,0,pre-owned,1595000.0,flat,0,Other,2 bed flat for sale,51.5294,-0.0917,174.0,2,2,1,2021-01-05,1700000.0,1,1,0,Old Street,423,33
3502,3502,Islington,2021-01-04,JTM Homes - Archway,1,"Nyton Close, Fairbridge Road N19",0,0,pre-owned,450000.0,flat,0,Other,2 bed flat for sale,51.567699,-0.125661,76.0,2,1,1,2021-01-04,470000.0,0,0,1,Archway,644,11
3503,3503,Kensington and Chelsea,2021-07-01,Chestertons - South Kensington,0,"Barkston Gardens, Earls Court, London SW5",0,0,pre-owned,2000000.0,maisonette,0,share_of_freehold,3 bed maisonette for sale,51.491852,-0.190304,125.0,3,2,1,2021-07-01,2000000.0,1,0,1,Chesham,489,61
3504,3504,Kensington and Chelsea,2021-07-01,Berkshire Hathaway HomeServices Knightsbridge,0,"Knightsbridge Court, 12 Sloane Street SW1X",0,0,pre-owned,2275000.0,flat,0,leasehold,3 bed flat for sale,51.500361,-0.159955,105.0,3,2,1,2021-07-01,2275000.0,1,0,0,Knightsbridge,128,68
3505,3505,Kensington and Chelsea,2021-07-01,Berkshire Hathaway HomeServices Knightsbridge,0,"7 Sloane Street, Knightsbridge SW1X",0,0,pre-owned,3250000.0,flat,0,leasehold,3 bed flat for sale,51.500866,-0.160291,173.0,3,3,2,2021-07-01,3250000.0,0,0,0,Knightsbridge,86,66
3506,3506,Kensington and Chelsea,2021-07-01,Berkshire Hathaway HomeServices Knightsbridge,0,"Park Close, Ilchester Place W14",0,0,pre-owned,1100000.0,terraced,0,leasehold,Terraced house for sale,51.499662,-0.201011,200.0,0,0,0,2021-07-01,1100000.0,0,1,1,Chesham,644,30
3507,3507,Kensington and Chelsea,2021-07-01,Berkshire Hathaway HomeServices Knightsbridge,0,"Basil Street, Knightsbridge SW3",0,0,pre-owned,4500000.0,flat,0,leasehold,2 bed flat for sale,51.500306,-0.161146,182.0,2,2,1,2021-07-01,4500000.0,1,0,0,Knightsbridge,150,68
3508,3508,Kensington and Chelsea,2021-07-01,Savills - Earl's Court,0,"Wetherby Mansions, Earl's Court, London SW5",0,0,pre-owned,1395000.0,flat,0,share_of_freehold,3 bed flat for sale,51.489656,-0.191342,110.0,3,3,2,2021-07-01,1395000.0,0,0,1,West Brompton,378,53
3509,3509,Kensington and Chelsea,2021-07-01,White Estates Ltd,0,"Bolton Gardens, South Kensington, London SW5",0,0,pre-owned,1125000.0,flat,0,share_of_freehold,2 bed flat for sale,51.490708,-0.187834,80.0,2,1,1,2021-07-01,1125000.0,1,0,1,Gloucester Road,528,80
3510,3510,Kensington and Chelsea,2021-07-01,ML Estates,1,"Bramley Road, Notting Hill W10",0,0,pre-owned,900000.0,retail,1,freehold,2 bed property for sale,51.512917,-0.217819,122.0,2,1,1,2021-07-01,900000.0,1,0,1,Latimer Road,176,7
3511,3511,Kensington and Chelsea,2021-07-01,Knight Frank - Knightsbridge Sales,0,"Cadogan Square, London SW1X",0,0,pre-owned,3395000.0,flat,0,Other,2 bed flat for sale,51.4944,-0.160521,144.0,2,3,1,2021-07-01,3395000.0,0,1,1,Sloane Square,352,62
3512,3512,Kensington and Chelsea,2021-07-01,Knight Frank - Notting Hill Sales,0,"Kensington Gardens Square, London W2",0,0,pre-owned,1450000.0,flat,0,Other,2 bed flat for sale,51.5145,-0.190284,65.0,2,2,1,2021-07-01,1450000.0,1,1,1,Bayswater,436,88
3513,3513,Kensington and Chelsea,2021-07-01,Marsh & Parsons - Earls Court,1,"Old Manor Yard, London SW5",0,0,new,2495000.0,mews,0,freehold,5 bed mews house for sale,51.491647,-0.193352,149.0,5,3,2,2021-07-01,2495000.0,1,0,0,Earl's Court,406,50
3514,3514,Kensington and Chelsea,2021-07-01,Harding Green,0,"Ifield Road, London SW10",0,0,pre-owned,3000000.0,terraced,0,freehold,4 bed terraced house for sale,51.484574,-0.188021,239.0,4,3,4,2021-07-01,3000000.0,1,1,1,West Brompton,606,28
3515,3515,Kensington and Chelsea,2021-07-01,Marsh & Parsons - Earls Court,0,"Warwick Road, London SW5",0,0,pre-owned,700000.0,flat,0,leasehold,3 bed flat for sale,51.490935,-0.198017,84.0,3,1,1,2021-07-01,700000.0,0,0,1,Earl's Court,226,48
3516,3516,Kensington and Chelsea,2021-07-01,Anthony Sharp,0,"Kensington Park Road, London W11",0,0,pre-owned,4250000.0,terraced,0,freehold,3 bed terraced house for sale,51.514374,-0.204803,206.0,3,3,2,2021-07-01,4250000.0,0,0,0,Ladbroke Grove,474,51
3517,3517,Kensington and Chelsea,2021-06-30,Savills - Knightsbridge,0,"Bowland Yard, Kinnerton Street, Knightsbridge, London SW1X",0,0,pre-owned,1850000.0,mews,0,leasehold,2 bed mews house for sale,51.501575,-0.157515,111.0,2,2,1,2021-06-30,1850000.0,0,0,0,Chesham,350,53
3518,3518,Kensington and Chelsea,2021-06-30,John D Wood & Co. - Chelsea Green,0,"Oakley Street, London SW3",0,0,pre-owned,920000.0,flat,0,share_of_freehold,1 bed flat for sale,51.486584,-0.169473,56.0,1,1,1,2021-06-30,920000.0,1,0,1,Chesham,854,47
3519,3519,Kensington and Chelsea,2021-06-30,John D Wood & Co. - Chelsea Green,0,"Pheasantry House, 4 Jubilee Place, London SW3",0,0,pre-owned,1450000.0,flat,0,share_of_freehold,2 bed flat for sale,51.489541,-0.16598,72.0,2,1,1,2021-06-30,1450000.0,1,1,0,Chesham,632,55
3520,3520,Kensington and Chelsea,2021-06-30,Savills - Kensington,0,"Sutherland House, Marloes Road, London W8",0,0,pre-owned,1825000.0,flat,0,share_of_freehold,2 bed flat for sale,51.497914,-0.192124,97.0,2,2,1,2021-06-30,1825000.0,0,0,0,High Street Kensington,360,59
3521,3521,Kensington and Chelsea,2021-06-30,Londonwide Estates,0,"Chatsworth Court, Pembroke Road, London W8",0,0,pre-owned,455000.0,flat,0,share_of_freehold,1 bed flat for sale,51.494976,-0.199186,41.0,1,0,0,2021-06-30,455000.0,0,0,1,Earl's Court,357,54
3522,3522,Kensington and Chelsea,2021-06-30,Savills - Chelsea,0,"Chelsea Square, London SW3",0,0,pre-owned,11950000.0,terraced,0,freehold,5 bed terraced house for sale,51.488452,-0.174032,445.0,5,4,3,2021-06-30,11950000.0,0,0,1,South Kensington,721,65
3523,3523,Kensington and Chelsea,2021-06-30,Savills - Chelsea,0,"Tregunter Road, London SW10",0,0,pre-owned,18750000.0,semi_detached,0,freehold,7 bed semi-detached house for sale,51.486576,-0.185817,583.0,7,7,4,2021-06-30,18750000.0,1,1,1,Chesham,697,52
3524,3524,Kensington and Chelsea,2021-06-30,Savills - Chelsea,0,"Cheyne Gardens, London SW3",0,0,pre-owned,4500000.0,flat,0,leasehold,2 bed flat for sale,51.484563,-0.166208,146.0,2,2,0,2021-06-30,4500000.0,1,0,1,Chesham,966,32
3525,3525,Kensington and Chelsea,2021-06-30,Savills - Chelsea,0,"Bramerton Street, London SW3",0,0,pre-owned,6950000.0,terraced,0,freehold,4 bed terraced house for sale,51.485767,-0.170784,254.0,4,3,2,2021-06-30,6950000.0,1,0,1,South Kensington,974,47
3526,3526,Kensington and Chelsea,2021-06-30,Savills - Notting Hill,0,"Queensdale Place, London W11",0,0,pre-owned,3800000.0,terraced,0,freehold,5 bed terraced house for sale,51.507358,-0.213942,195.0,5,2,2,2021-06-30,3800000.0,0,0,1,Shepherd's Bush (C),487,20
3527,3527,Kensington and Chelsea,2021-06-30,Savills - Kensington,0,"Academy Gardens, Duchess Of Bedfords Walk, London W8",0,0,pre-owned,1350000.0,flat,0,leasehold,1 bed flat for sale,51.503161,-0.197637,62.0,1,1,1,2021-06-30,1350000.0,0,1,1,High Street Kensington,405,33
3528,3528,Kensington and Chelsea,2021-06-30,Savills - Earl's Court,0,"Old Brompton Road, London SW5",0,0,pre-owned,740000.0,flat,0,leasehold,1 bed flat for sale,51.489019,-0.192029,61.0,1,1,1,2021-06-30,740000.0,1,0,0,West Brompton,251,42
3529,3529,Kensington and Chelsea,2021-06-30,Savills - Earl's Court,0,"Wetherby Place, London SW7",0,0,pre-owned,695000.0,flat,0,share_of_freehold,1 bed flat for sale,51.492691,-0.182895,52.0,1,1,1,2021-06-30,695000.0,0,0,1,Gloucester Road,242,64
3530,3530,Kensington and Chelsea,2021-06-30,Peabody,0,"Railway, Lockton Street, London W10",0,1,pre-owned,150000.0,flat,0,leasehold,2 bed flat for sale,51.513212,-0.21856,73.0,2,1,0,2021-06-30,150000.0,1,1,1,Latimer Road,337,8
3531,3531,Kensington and Chelsea,2021-06-30,Dexters - Westbourne Grove,0,"St. Ervans Road, London W10",0,0,pre-owned,500000.0,flat,0,leasehold,3 bed flat for sale,51.522413,-0.206587,78.0,3,1,1,2021-06-30,500000.0,0,0,0,Westbourne Park,470,35
3532,3532,Kensington and Chelsea,2021-06-30,John D Wood & Co. - Chelsea Green,0,"Oakley Street, Chelsea, London SW3",0,0,pre-owned,1600000.0,flat,0,share_of_freehold,2 bed flat for sale,51.485388,-0.168484,111.0,2,2,1,2021-06-30,1600000.0,1,0,0,Chesham,958,38
3533,3533,Kensington and Chelsea,2021-06-30,Knight Frank - Queens Park Sales,1,"Bruckner Street, London W10",0,0,new,800000.0,flat,0,Other,2 bed flat for sale,51.5287,-0.206,81.0,2,2,1,2021-06-30,800000.0,1,0,0,Queen's Park,574,11
3534,3534,Kensington and Chelsea,2021-06-30,The Modern House,0,"Gunter Grove, London SW10",0,0,pre-owned,3250000.0,semi_detached,0,freehold,3 bed semi-detached house for sale,51.483105,-0.184659,207.0,3,3,0,2021-06-30,3250000.0,1,0,1,Fulham Broadway,785,45
3535,3535,Kensington and Chelsea,2021-06-30,John D Wood & Co. - Chelsea Green,0,"Crown Lodge, 12 Elystan Street, London SW3",0,0,pre-owned,2750000.0,maisonette,0,share_of_freehold,3 bed maisonette for sale,51.491554,-0.167008,139.0,3,3,1,2021-06-30,2750000.0,1,1,1,South Kensington,610,59
3536,3536,Kensington and Chelsea,2021-06-30,Barnard Marcus - Earl's Court,0,"Slaidburn Street, London SW10",0,0,pre-owned,415000.0,flat,0,leasehold,1 bed flat for sale,51.482384,-0.181677,46.0,1,1,1,2021-06-30,415000.0,1,1,0,Chesham,960,50
3537,3537,Kensington and Chelsea,2021-06-29,Savills - Earl's Court,0,"Cromwell Road, London SW5",0,0,pre-owned,1495000.0,flat,0,share_of_freehold,3 bed flat for sale,51.494489,-0.191611,143.0,3,2,1,2021-06-29,1495000.0,0,0,1,Earl's Court,478,46
3538,3538,Kensington and Chelsea,2021-06-29,Savills - Chelsea,0,"Harcourt Terrace, London SW10",0,0,pre-owned,850000.0,flat,0,share_of_freehold,1 bed flat for sale,51.487737,-0.186463,48.0,1,1,1,2021-06-29,850000.0,0,0,0,Chesham,627,51
3539,3539,Kensington and Chelsea,2021-06-29,Savills - Notting Hill,1,"Bassett Road, London W10",0,0,new,3250000.0,flat,0,leasehold,3 bed flat for sale,51.518009,-0.217201,203.0,3,0,0,2021-06-29,3250000.0,1,1,1,Latimer Road,414,4
3540,3540,Kensington and Chelsea,2021-06-29,Savills - Notting Hill,1,"Bassett Road, London W10",0,0,new,2650000.0,flat,0,leasehold,3 bed flat for sale,51.518009,-0.217201,128.0,3,0,0,2021-06-29,2650000.0,0,1,1,Latimer Road,414,4
3541,3541,Kensington and Chelsea,2021-06-29,Savills - Notting Hill,1,"Bassett Road, London W10",0,0,new,3750000.0,flat,0,leasehold,3 bed flat for sale,51.518009,-0.217201,214.0,3,0,0,2021-06-29,3750000.0,0,1,1,Latimer Road,414,4
3542,3542,Kensington and Chelsea,2021-06-29,Savills - Notting Hill,0,"Lansdowne Road, London W11",0,0,pre-owned,1450000.0,flat,0,share_of_freehold,2 bed flat for sale,51.512812,-0.207805,102.0,2,2,2,2021-06-29,1450000.0,0,0,1,Ladbroke Grove,437,31
3543,3543,Kensington and Chelsea,2021-06-29,Knight Frank - Notting Hill Sales,0,"Portland Road, Notting Hill, London W11",0,0,pre-owned,3200000.0,terraced,0,Other,4 bed terraced house for sale,51.5108,-0.2107,185.0,4,3,1,2021-06-29,3200000.0,1,0,1,Holland Park,500,11
3544,3544,Kensington and Chelsea,2021-06-29,Knight Frank - Kensington Sales,0,"13 Vicarage Gate, London W8",0,0,pre-owned,4000000.0,flat,0,Other,3 bed flat for sale,51.5052,-0.1922,229.0,3,3,2,2021-06-29,4000000.0,0,0,0,High Street Kensington,439,55
3545,3545,Kensington and Chelsea,2021-06-29,Ashdown Marks,0,"Cadogan Lane, London SW1X",0,0,pre-owned,1250000.0,terraced,0,leasehold,3 bed terraced house for sale,51.496503,-0.156927,122.0,3,2,2,2021-06-29,1250000.0,1,0,0,Sloane Square,366,44
3546,3546,Kensington and Chelsea,2021-06-29,Maskells,0,"Cadogan Square, Knightsbridge SW1X",0,0,pre-owned,3350000.0,flat,0,Other,3 bed flat for sale,51.495964,-0.16087,167.0,3,3,1,2021-06-29,3350000.0,1,0,1,Chesham,456,63
3547,3547,Kensington and Chelsea,2021-06-28,Strutt & Parker - Chelsea SW10,0,"Chelsea Park Gardens, London SW3",0,0,pre-owned,4750000.0,semi_detached,0,freehold,5 bed semi-detached house for sale,51.484953,-0.17641,1.0,5,3,2,2021-06-28,4750000.0,1,0,1,Chesham,968,54
3548,3548,Kensington and Chelsea,2021-06-28,Aylesford International,0,"Chesham House, 30-31 Chesham Place, London SW1X",0,0,pre-owned,10250000.0,flat,0,share_of_freehold,3 bed flat for sale,51.496837,-0.155285,302.0,3,4,1,2021-06-28,10250000.0,0,0,0,Sloane Square,493,44
3549,3549,Kensington and Chelsea,2021-06-28,Rose & Partners,0,"Chelsea Park Gardens, London SW3",0,0,pre-owned,4750000.0,terraced,0,freehold,5 bed terraced house for sale,51.484575,-0.17737,195.0,5,3,1,2021-06-28,4750000.0,0,1,1,Chesham,1009,53
3550,3550,Kensington and Chelsea,2021-06-28,Knight Frank - Notting Hill Sales,0,"Ladbroke Grove, London W10",0,0,pre-owned,1625000.0,flat,0,Other,3 bed flat for sale,51.520252,-0.211679,115.0,3,3,1,2021-06-28,1625000.0,1,0,0,Ladbroke Grove,332,36
3551,3551,Kensington and Chelsea,2021-06-28,Safinia Property Consultants Ltd,0,"Albert Hall Mansions, Kensington Gore, Kensington, London SW7",0,0,pre-owned,1895000.0,Other,0,share_of_freehold,1 bed property for sale,51.501441,-0.176568,94.0,1,0,0,2021-06-28,1895000.0,0,0,0,South Kensington,778,14
3552,3552,Kensington and Chelsea,2021-06-28,Napier Watt,0,"Greville House, Kinnerton Street, Knightsbridge SW1X",0,0,pre-owned,2375000.0,flat,0,Other,2 bed flat for sale,51.502173,-0.159899,84.0,2,2,1,2021-06-28,2375000.0,0,0,0,Knightsbridge,68,55
3553,3553,Kensington and Chelsea,2021-06-28,Anthony Sharp,0,"Holland Villas Road, London W14",0,0,pre-owned,1900000.0,flat,0,leasehold,3 bed flat for sale,51.50431,-0.212344,122.0,3,2,1,2021-06-28,1900000.0,1,0,0,Upminster,459,16
3554,3554,Kensington and Chelsea,2021-06-28,Maskells,0,"Walton Street, Chelsea SW3",0,0,pre-owned,550000.0,flat,0,Other,1 bed flat for sale,51.494586,-0.166221,42.0,1,1,1,2021-06-28,550000.0,0,0,0,South Kensington,661,62
3555,3555,Kensington and Chelsea,2021-06-28,Chestertons - Notting Hill,0,"Portobello Road, Notting Hill, London W11",0,0,pre-owned,2850000.0,flat,0,leasehold,4 bed flat for sale,51.51283,-0.202472,166.0,4,2,1,2021-06-28,2850000.0,1,0,0,Upminster,483,56
