,index,Borough,date_listed,agency_name,chain_free,address,isRetirementHome,isSharedOwnership,listingCondition,price,propertyType,isAuction,tenure,title,latitude,longitude,floor_area_msq,numBedrooms,numBathrooms,numLivingRooms,firstPublishedDate,firstPublishedPrice,balcony_terrace,parking,garden,closest_station_name,closest_station_distance_sec,pub_restaurant
3761,3761,Kensington and Chelsea,2021-06-04,Allsop LLP,0,"37 Cambridge Gardens, Ladbroke Grove, London W10",0,0,pre-owned,1800000.0,Other,1,leasehold,5 bed property for sale,51.518287,-0.209464,287.0,5,5,5,2021-06-04,1750000.0,0,0,0,Ladbroke Grove,212,48
3762,3762,Kensington and Chelsea,2021-06-04,Savills - Knightsbridge,0,"Queen's Gate Gardens, London SW7",0,0,pre-owned,1200000.0,flat,0,leasehold,2 bed flat for sale,51.495707,-0.182573,117.0,2,1,1,2021-06-04,1250000.0,0,0,1,Gloucester Road,196,65
3763,3763,Kensington and Chelsea,2021-06-04,Savills - Knightsbridge,0,"Onslow Square, London SW7",0,0,pre-owned,475000.0,flat,0,leasehold,2 bed flat for sale,51.493419,-0.173041,97.0,2,2,1,2021-06-04,475000.0,1,0,0,South Kensington,212,78
3764,3764,Kensington and Chelsea,2021-06-04,Domus Nova,0,"Lansdowne Road, Notting Hill, Kensington &amp; Chelsea W11",0,0,pre-owned,1100000.0,flat,0,Other,1 bed flat for sale,51.513283,-0.2074,64.0,1,1,1,2021-06-04,1100000.0,1,0,0,Ladbroke Grove,396,34
3765,3765,Kensington and Chelsea,2021-06-04,JLL - Kensington,0,"Warwick Gardens, London W14",0,0,pre-owned,800000.0,flat,0,leasehold,1 bed flat for sale,51.496518,-0.204266,69.0,1,1,1,2021-06-04,800000.0,0,0,0,Upminster,471,32
3766,3766,Kensington and Chelsea,2021-06-04,Martin & Co - Chelsea,1,"Carlyle Court, Chelsea Harbour, London SW10",0,0,pre-owned,900000.0,flat,0,Other,2 bed flat for sale,51.476478,-0.181214,86.0,2,2,1,2021-06-04,900000.0,1,1,1,Fulham Broadway,1073,17
3767,3767,Kensington and Chelsea,2021-06-04,Chestertons - Kensington,0,"Pater Street, Kensington, London W8",0,0,pre-owned,1200000.0,flat,0,leasehold,2 bed flat for sale,51.498233,-0.197629,91.0,2,2,1,2021-06-04,1200000.0,0,0,1,High Street Kensington,432,40
3768,3768,Kensington and Chelsea,2021-06-04,Notting Hill Residential,0,"Ladbroke Grove, London W10",0,0,pre-owned,360000.0,studio,0,share_of_freehold,Studio for sale,51.521294,-0.212042,35.0,0,1,1,2021-06-04,360000.0,0,0,1,Ladbroke Grove,415,28
3769,3769,Kensington and Chelsea,2021-06-04,Knight Frank - South Kensington Sales,0,"Onslow Gardens, London SW7",0,0,pre-owned,1450000.0,flat,0,freehold,2 bed flat for sale,51.491068,-0.178476,70.0,2,1,1,2021-06-04,1450000.0,0,0,1,Chesham,430,89
3770,3770,Kensington and Chelsea,2021-06-04,Harding Green,0,"Monterey Studios, 239 Kilburn Lane, London W10",0,0,pre-owned,750000.0,detached,0,freehold,4 bed detached house for sale,51.532974,-0.208892,121.0,4,2,2,2021-06-04,795000.0,1,0,1,Queen's Park,362,11
3771,3771,Kensington and Chelsea,2021-06-04,Moveli,0,"Queen's Gate, South Kensington, London SW7",0,0,pre-owned,2750000.0,flat,0,leasehold,3 bed flat for sale,51.494564,-0.178793,134.0,3,2,1,2021-06-04,2750000.0,1,0,0,Gloucester Road,335,94
3772,3772,Kensington and Chelsea,2021-06-03,Savills - Notting Hill,0,"Tavistock Road, London W11",0,0,pre-owned,795000.0,flat,0,leasehold,1 bed flat for sale,51.519336,-0.203974,53.0,1,1,1,2021-06-03,795000.0,1,0,0,Westbourne Park,246,60
3773,3773,Kensington and Chelsea,2021-06-03,Savills - Earl's Court,0,"Collingham Gardens, London SW5",0,0,pre-owned,1350000.0,flat,0,leasehold,2 bed flat for sale,51.492178,-0.188692,87.0,2,2,1,2021-06-03,1350000.0,0,0,1,Gloucester Road,464,78
3774,3774,Kensington and Chelsea,2021-06-03,Farrar & Co,0,"Onslow Square, London SW7",0,0,pre-owned,1250000.0,flat,0,leasehold,1 bed flat for sale,51.49342,-0.173017,73.0,1,1,1,2021-06-03,1250000.0,1,0,1,South Kensington,212,78
3775,3775,Kensington and Chelsea,2021-06-03,Douglas & Gordon - Chelsea,0,"Eaton Square, London SW1W",0,0,pre-owned,7300000.0,flat,0,leasehold,4 bed flat for sale,51.497618,-0.149988,216.0,4,4,3,2021-06-03,7300000.0,1,0,1,Victoria,329,62
3776,3776,Kensington and Chelsea,2021-06-03,Stanley Chelsea,0,"Finborough Road, London SW10",0,0,pre-owned,600000.0,flat,0,Other,1 bed flat for sale,51.486,-0.189511,39.0,1,1,1,2021-06-03,600000.0,1,0,0,West Brompton,473,26
3777,3777,Kensington and Chelsea,2021-06-03,Rickman Properties Ltd,0,"Kensington Court Place, Kensington W8",0,0,pre-owned,3400000.0,Other,0,freehold,3 bed property for sale,51.499931,-0.187678,179.0,3,2,2,2021-06-03,3400000.0,0,0,0,Chesham,627,51
3778,3778,Kensington and Chelsea,2021-06-03,Holcroft Property Consultants,0,"Stafford Terrace, London W8",0,0,pre-owned,4150000.0,flat,0,share_of_freehold,4 bed flat for sale,51.500523,-0.19716,199.0,4,3,2,2021-06-03,4150000.0,0,0,1,High Street Kensington,290,41
3779,3779,Kensington and Chelsea,2021-06-03,Knight Frank - Knightsbridge Sales,0,"Princes Gate, London SW7",0,0,pre-owned,6750000.0,flat,0,Other,3 bed flat for sale,51.501363,-0.169223,213.0,3,2,2,2021-06-03,6750000.0,1,0,0,Knightsbridge,456,38
3780,3780,Kensington and Chelsea,2021-06-02,Hunter Realty,0,"Princes Square, London W2",0,0,pre-owned,1325000.0,flat,0,leasehold,1 bed flat for sale,51.512743,-0.192719,43.0,1,1,1,2021-06-02,1325000.0,0,1,0,Chesham,444,108
3781,3781,Kensington and Chelsea,2021-06-02,Harrods Estates,0,"Ovington Court, Brompton Road, Knightsbridge, London SW3",0,0,pre-owned,1950000.0,flat,0,leasehold,2 bed flat for sale,51.497612,-0.166895,76.0,2,2,1,2021-06-02,1950000.0,0,0,0,Knightsbridge,488,72
3782,3782,Kensington and Chelsea,2021-06-02,John D Wood & Co. - Chelsea Green,0,"Jubilee Place, Chelsea, London SW3",0,0,pre-owned,4650000.0,terraced,0,freehold,4 bed terraced house for sale,51.489582,-0.166396,211.0,4,3,1,2021-06-02,4650000.0,1,0,0,Chesham,629,55
3783,3783,Kensington and Chelsea,2021-06-02,Knight Frank - Kensington Sales,0,"Lower Addison Gardens, London W14",0,0,pre-owned,1100000.0,flat,0,leasehold,2 bed flat for sale,51.5031,-0.2135,74.0,2,1,1,2021-06-02,1100000.0,0,0,1,Shepherd's Bush (C),414,23
3784,3784,Kensington and Chelsea,2021-06-02,Knightsbridge Estate Agents,0,"Walton Street, London SW3",0,0,pre-owned,2695000.0,flat,0,Other,3 bed flat for sale,51.497549,-0.163425,99.0,3,2,0,2021-06-02,2695000.0,0,0,0,Knightsbridge,473,76
3785,3785,Kensington and Chelsea,2021-06-02,Knightsbridge Estate Agents,0,"Kensington Gore, London SW7",0,0,pre-owned,6300000.0,flat,0,Other,4 bed flat for sale,51.500897,-0.17571,238.0,4,3,0,2021-06-02,6300000.0,0,0,0,South Kensington,695,9
3786,3786,Kensington and Chelsea,2021-06-02,Savills - Chelsea,0,"Fawcett Street, London SW10",0,0,pre-owned,3400000.0,terraced,0,freehold,5 bed terraced house for sale,51.485248,-0.184804,279.0,5,3,3,2021-06-02,3400000.0,1,0,1,Chesham,769,45
3787,3787,Kensington and Chelsea,2021-06-02,Knight Frank - South Kensington Sales,0,"Elvaston Mews, London SW7",0,0,pre-owned,5500000.0,terraced,0,Other,4 bed terraced house for sale,51.4973,-0.180579,301.0,4,3,2,2021-06-02,5500000.0,0,0,0,Gloucester Road,404,86
3788,3788,Kensington and Chelsea,2021-06-02,JLL - Kensington,0,"Kensington High Street, London W14",0,0,pre-owned,625000.0,flat,0,leasehold,1 bed flat for sale,51.496473,-0.207812,52.0,1,1,1,2021-06-02,625000.0,1,0,1,Kensington (Olympia),357,27
3789,3789,Kensington and Chelsea,2021-06-02,Northwest 6,0,"Mall Chambers, Kensington Mall, London W8",0,0,pre-owned,525000.0,flat,0,Other,2 bed flat for sale,51.508266,-0.194456,51.0,2,1,1,2021-06-02,550000.0,0,0,1,Notting Hill Gate,192,57
3790,3790,Kensington and Chelsea,2021-06-02,Moveli,0,"Beaufort Gardens, Knightsbridge, London SW3",0,0,pre-owned,3950000.0,flat,0,freehold,3 bed flat for sale,51.49831,-0.164468,133.0,3,2,1,2021-06-02,3950000.0,1,0,0,Knightsbridge,372,64
3791,3791,Kensington and Chelsea,2021-06-02,Chester and Son,0,"Ladbroke Grove, London W10",0,0,pre-owned,485000.0,flat,0,share_of_freehold,1 bed flat for sale,51.524072,-0.214148,51.0,1,1,1,2021-06-02,485000.0,0,0,0,Ladbroke Grove,664,14
3792,3792,Kensington and Chelsea,2021-06-01,Harrods Estates,1,"Chesham Street, Belgravia SW1X",0,0,new,7350000.0,flat,0,share_of_freehold,3 bed flat for sale,51.495492,-0.156103,163.0,3,3,2,2021-06-01,7350000.0,0,1,0,Sloane Square,371,43
3793,3793,Kensington and Chelsea,2021-06-01,Harrods Estates,1,"Chesham Street, Belgravia SW1X",0,0,new,8350000.0,flat,0,share_of_freehold,3 bed flat for sale,51.495492,-0.156103,174.0,3,3,2,2021-06-01,8350000.0,1,1,0,Sloane Square,371,43
3794,3794,Kensington and Chelsea,2021-06-01,Savills - Kensington,0,"Kensington Square, London W8",0,0,pre-owned,8150000.0,end_terrace,0,freehold,4 bed end terrace house for sale,51.500296,-0.189148,356.0,4,3,3,2021-06-01,8150000.0,0,0,1,High Street Kensington,292,53
3795,3795,Kensington and Chelsea,2021-06-01,Daniel Daggers Real Estate,0,"Ennismore Gardens, London SW7",0,0,pre-owned,7500000.0,flat,0,leasehold,2 bed flat for sale,51.500152,-0.170405,151.0,2,2,1,2021-06-01,7500000.0,0,0,1,Chesham,640,32
3796,3796,Kensington and Chelsea,2021-06-01,Nested Ltd,1,"Hans Crescent, Knightsbridge, London SW1X",0,0,pre-owned,1895000.0,flat,0,share_of_freehold,2 bed flat for sale,51.498993,-0.161451,166.0,2,2,2,2021-06-01,1895000.0,0,0,0,Knightsbridge,275,70
3797,3797,Kensington and Chelsea,2021-06-01,Knight Frank - Notting Hill Sales,0,"Blenheim Crescent, Notting Hill, London W11",0,0,pre-owned,800000.0,flat,0,Other,1 bed flat for sale,51.515887,-0.205049,42.0,1,1,1,2021-06-01,800000.0,0,0,0,Ladbroke Grove,405,49
3798,3798,Kensington and Chelsea,2021-06-01,The Modern House,0,"Fifth Avenue, London W10",0,0,pre-owned,625000.0,flat,0,leasehold,2 bed flat for sale,51.528457,-0.211852,84.0,2,2,0,2021-06-01,625000.0,1,0,0,Queen's Park,713,20
3799,3799,Kensington and Chelsea,2021-06-01,Knightsbridge Estate Agents,0,"Royal Warwick Square, Kensington W14",0,0,pre-owned,5750000.0,flat,0,Other,3 bed flat for sale,51.494865,-0.204965,227.0,3,4,0,2021-06-01,5750000.0,0,0,0,Upminster,578,28
3800,3800,Kensington and Chelsea,2021-05-29,Knight Frank - New Homes Broker Team,0,"The Auria, Portobello Road, London W10",0,0,pre-owned,1057500.0,flat,0,Other,2 bed flat for sale,51.522572,-0.209556,73.0,2,2,1,2021-05-29,1057500.0,1,0,0,Upminster,588,27
3801,3801,Kensington and Chelsea,2021-05-29,Knight Frank - New Homes Broker Team,0,"The Auria, Portobello Road, London W10",0,0,pre-owned,715000.0,flat,0,Other,1 bed flat for sale,51.522572,-0.209556,53.0,1,1,1,2021-05-29,715000.0,1,0,0,Upminster,588,27
3802,3802,Kensington and Chelsea,2021-05-29,Knight Frank - New Homes Broker Team,0,"The Auria, Portobello Road, London W10",0,0,pre-owned,675000.0,flat,0,Other,1 bed flat for sale,51.522572,-0.209556,51.0,1,1,1,2021-05-29,675000.0,1,0,0,Upminster,588,27
3803,3803,Kensington and Chelsea,2021-05-29,Knight Frank - New Homes Broker Team,0,"The Auria, Portobello Road, London W10",0,0,pre-owned,995000.0,flat,0,Other,2 bed flat for sale,51.522572,-0.209556,73.0,2,2,1,2021-05-29,995000.0,1,0,0,Upminster,588,27
3804,3804,Kensington and Chelsea,2021-05-29,"Purplebricks, Head Office",0,"351 Westbourne Park Road, London W11",0,0,pre-owned,550000.0,flat,0,leasehold,2 bed flat for sale,51.515729,-0.208826,71.0,2,1,1,2021-05-29,550000.0,0,0,0,Ladbroke Grove,178,42
3805,3805,Kensington and Chelsea,2021-05-29,White Estates Ltd,0,"Roland Gardens, South Kensington, London SW7",0,0,pre-owned,1300000.0,flat,0,share_of_freehold,3 bed flat for sale,51.490423,-0.180449,105.0,3,2,1,2021-05-29,1350000.0,0,0,0,Gloucester Road,433,95
3806,3806,Kensington and Chelsea,2021-05-29,Knight Frank - Chelsea Sales,0,"Alexandra Mansions, Kings Road, Chelsea London SW3",0,0,pre-owned,625000.0,flat,0,Other,1 bed flat for sale,51.4841,-0.1759,43.0,1,1,1,2021-05-29,625000.0,0,0,0,Chesham,1091,52
3807,3807,Kensington and Chelsea,2021-05-29,White Estates Ltd,0,"Bolton Gardens, South Kensington, London SW5",0,0,pre-owned,3150000.0,flat,0,share_of_freehold,2 bed flat for sale,51.491089,-0.186115,119.0,2,2,2,2021-05-29,3150000.0,1,0,1,Gloucester Road,479,67
3808,3808,Kensington and Chelsea,2021-05-28,Winkworth - South Kensington,0,"Brechin Place, London SW7",0,0,pre-owned,995000.0,flat,0,share_of_freehold,2 bed flat for sale,51.4915,-0.181473,62.0,2,1,1,2021-05-28,995000.0,0,0,0,Gloucester Road,344,74
3809,3809,Kensington and Chelsea,2021-05-28,Savills - Notting Hill,0,"St. Marks Place, London W11",0,0,pre-owned,3300000.0,terraced,0,freehold,5 bed terraced house for sale,51.515188,-0.209658,191.0,5,2,3,2021-05-28,3300000.0,0,0,1,Ladbroke Grove,235,41
3810,3810,Kensington and Chelsea,2021-05-28,Savills - Knightsbridge,0,"Trevor Street, Knightsbridge, London SW7",0,0,pre-owned,6495000.0,terraced,0,freehold,5 bed terraced house for sale,51.501072,-0.165027,283.0,5,5,3,2021-05-28,6495000.0,1,0,1,Knightsbridge,240,51
3811,3811,Kensington and Chelsea,2021-05-28,Savills - Kensington,0,"Berkeley Gardens, London W8",0,0,pre-owned,1250000.0,flat,0,share_of_freehold,2 bed flat for sale,51.506405,-0.193978,65.0,2,2,1,2021-05-28,1250000.0,1,0,1,Notting Hill Gate,331,62
3812,3812,Kensington and Chelsea,2021-05-28,Savills - Chelsea,0,"Upper Cheyne Row, Chelsea, London SW3",0,0,pre-owned,19950000.0,terraced,0,freehold,6 bed terraced house for sale,51.484537,-0.169191,697.0,6,5,4,2021-05-28,19950000.0,1,1,1,Chesham,1169,40
3813,3813,Kensington and Chelsea,2021-05-28,Savills - Chelsea,0,"Westgate Terrace, London SW10",0,0,pre-owned,2500000.0,maisonette,0,share_of_freehold,4 bed maisonette for sale,51.486882,-0.188729,159.0,4,2,1,2021-05-28,2695000.0,1,0,0,West Brompton,491,33
3814,3814,Kensington and Chelsea,2021-05-28,Knight Frank - South Kensington Sales,0,"Cornwall Gardens, London SW7",0,0,pre-owned,3200000.0,flat,0,Other,2 bed flat for sale,51.496593,-0.186082,110.0,2,2,1,2021-05-28,3200000.0,1,0,1,Gloucester Road,357,57
3815,3815,Kensington and Chelsea,2021-05-28,Thackerays,0,"Iverna Court, London W8",0,0,pre-owned,3200000.0,flat,0,share_of_freehold,4 bed flat for sale,51.500165,-0.194052,157.0,4,3,1,2021-05-28,3200000.0,1,0,1,High Street Kensington,153,54
3816,3816,Kensington and Chelsea,2021-05-28,Lets Talk Property,0,"Kensington Gardens Square, London W2",0,0,pre-owned,585000.0,flat,0,Other,1 bed flat for sale,51.513473,-0.189589,38.0,1,1,1,2021-05-28,585000.0,0,0,1,Bayswater,339,90
3817,3817,Kensington and Chelsea,2021-05-28,Pereds,0,"Ovington Square, London SW3",0,0,pre-owned,5500000.0,flat,0,freehold,3 bed flat for sale,51.496594,-0.16502,305.0,3,3,2,2021-05-28,5500000.0,1,0,1,Knightsbridge,593,53
3818,3818,Kensington and Chelsea,2021-05-28,Russell Simpson,0,"Ovington Square, Chelsea, London SW3",0,0,pre-owned,5500000.0,flat,0,freehold,3 bed flat for sale,51.496743,-0.165037,305.0,3,3,2,2021-05-28,5500000.0,1,0,1,Knightsbridge,549,55
3819,3819,Kensington and Chelsea,2021-05-28,Homesite,0,"Colville Road, Notting Hill W11",0,0,pre-owned,550000.0,flat,0,leasehold,1 bed flat for sale,51.51457,-0.201852,46.0,1,1,1,2021-05-28,550000.0,0,0,0,Upminster,531,51
3820,3820,Kensington and Chelsea,2021-05-28,Chestertons - Knightsbridge & Belgravia,0,"Chalfont House, Chesham Street, Belgravia SW1X",0,0,pre-owned,3495000.0,flat,0,share_of_freehold,3 bed flat for sale,51.49595,-0.15607,137.0,3,3,1,2021-05-28,3495000.0,1,0,0,Sloane Square,382,39
3821,3821,Kensington and Chelsea,2021-05-28,Napi London,0,"Sloane Street, London SW1X",0,0,pre-owned,9750000.0,flat,0,leasehold,3 bed flat for sale,51.498551,-0.159668,293.0,3,2,2,2021-05-28,9750000.0,0,1,0,Knightsbridge,270,66
3822,3822,Kensington and Chelsea,2021-05-28,Knight Frank - South Kensington Sales,0,"Nevern Place, London SW5",0,0,pre-owned,1200000.0,flat,0,Other,2 bed flat for sale,51.492816,-0.19609,102.0,2,2,1,2021-05-28,1200000.0,0,0,0,Earl's Court,134,50
3823,3823,Kensington and Chelsea,2021-05-28,Strutt & Parker - South Kensington,0,"Bramham Gardens, London, London SW5",0,0,pre-owned,3150000.0,flat,0,share_of_freehold,3 bed flat for sale,51.490961,-0.188162,150.0,3,2,2,2021-05-28,3150000.0,1,0,1,Gloucester Road,534,79
3824,3824,Kensington and Chelsea,2021-05-28,Rigby and Marchant,0,"Lancaster Road, London W11",0,0,pre-owned,1550000.0,flat,0,Other,2 bed flat for sale,51.517787,-0.205317,103.0,2,1,1,2021-05-28,1550000.0,1,0,0,Upminster,305,56
3825,3825,Kensington and Chelsea,2021-05-27,Strutt & Parker - South Kensington,0,"Brechin Place, South Kensington, London SW7",0,0,pre-owned,3250000.0,flat,0,leasehold,3 bed flat for sale,51.491099,-0.181667,93.0,3,4,2,2021-05-27,3250000.0,0,0,1,Gloucester Road,403,75
3826,3826,Kensington and Chelsea,2021-05-27,JLL - Kensington,0,"Earls Court Road, London W8",0,0,pre-owned,700000.0,flat,0,share_of_freehold,1 bed flat for sale,51.496392,-0.196622,48.0,1,1,1,2021-05-27,700000.0,1,0,1,Earl's Court,504,59
3827,3827,Kensington and Chelsea,2021-05-27,Homesite,0,"Westbourne Grove, Bayswater W2",0,0,pre-owned,2095000.0,flat,0,Other,2 bed flat for sale,51.51496,-0.19053,128.0,2,2,2,2021-05-27,2295000.0,1,1,0,Bayswater,457,87
3828,3828,Kensington and Chelsea,2021-05-27,Domus Nova,0,"Tavistock Road, Notting Hill W11",0,0,pre-owned,795000.0,flat,0,Other,1 bed flat for sale,51.51942,-0.203803,51.0,1,1,1,2021-05-27,795000.0,1,0,0,Westbourne Park,235,61
3829,3829,Kensington and Chelsea,2021-05-27,Wellbelove Quested,0,"Egerton Gardens, London SW3",0,0,pre-owned,2650000.0,flat,0,leasehold,3 bed flat for sale,51.496038,-0.169177,134.0,3,2,0,2021-05-27,2650000.0,0,0,1,South Kensington,441,82
3830,3830,Kensington and Chelsea,2021-05-27,JLL - Kensington,0,"Queen's Gate, London SW7",0,0,pre-owned,3000000.0,flat,0,leasehold,2 bed flat for sale,51.500577,-0.180564,147.0,2,3,1,2021-05-27,3000000.0,0,0,0,Gloucester Road,699,24
3831,3831,Kensington and Chelsea,2021-05-27,JLL - Kensington,0,"Warwick Lane, London W14",0,0,pre-owned,919000.0,flat,0,leasehold,1 bed flat for sale,51.494865,-0.204965,57.0,1,1,1,2021-05-27,919000.0,1,0,0,Upminster,578,28
3832,3832,Kensington and Chelsea,2021-05-27,Knight Frank - Kensington Sales,0,"Iverna Gardens, London W8",0,0,pre-owned,900000.0,flat,0,leasehold,2 bed flat for sale,51.499591,-0.194161,67.0,2,2,1,2021-05-27,900000.0,0,0,1,High Street Kensington,146,53
3833,3833,Kensington and Chelsea,2021-05-27,Knight Frank - South Kensington Sales,0,"Brechin Place, South Kensington, London SW7",0,0,pre-owned,3250000.0,flat,0,leasehold,3 bed flat for sale,51.491341,-0.181618,154.0,3,3,1,2021-05-27,3250000.0,0,0,1,Gloucester Road,355,74
3834,3834,Kensington and Chelsea,2021-05-27,Knight Frank - Kensington Sales,0,"Vicarage Gate, Kensington, London W8",0,0,pre-owned,23000000.0,terraced,0,Other,6 bed terraced house for sale,51.5052,-0.192209,810.0,6,7,4,2021-05-27,23000000.0,1,0,1,High Street Kensington,439,55
3835,3835,Kensington and Chelsea,2021-05-26,Strutt & Parker - Kensington,0,"Vicarage Gate, Kensington, London W8",0,0,pre-owned,23000000.0,terraced,0,freehold,6 bed terraced house for sale,51.505173,-0.192435,810.0,6,7,3,2021-05-26,23000000.0,0,0,1,High Street Kensington,428,56
3836,3836,Kensington and Chelsea,2021-05-26,Strutt & Parker - Kensington,0,"Cheniston Gardens, Kensington, London W8",0,0,pre-owned,775000.0,flat,0,leasehold,1 bed flat for sale,51.499155,-0.193227,69.0,1,1,1,2021-05-26,775000.0,0,0,0,High Street Kensington,188,56
3837,3837,Kensington and Chelsea,2021-05-26,Chestertons - Notting Hill,1,"Blenheim Crescent, London W11",0,0,pre-owned,750000.0,flat,0,share_of_freehold,2 bed flat for sale,51.514899,-0.209568,51.0,2,1,1,2021-05-26,750000.0,1,0,0,Ladbroke Grove,287,40
3838,3838,Kensington and Chelsea,2021-05-26,Kinleigh Folkard & Hayward - South Kensington Sales,0,"Cornwall Gardens, London SW7",0,0,pre-owned,1399000.0,flat,0,Other,2 bed flat for sale,51.497249,-0.188664,84.0,2,2,0,2021-05-26,1500000.0,0,0,0,Chesham,515,77
3839,3839,Kensington and Chelsea,2021-05-26,Savills - Notting Hill,0,"Westbourne Grove, London W11",0,0,pre-owned,3595000.0,flat,0,leasehold,3 bed flat for sale,51.514682,-0.196577,204.0,3,2,2,2021-05-26,3595000.0,0,0,0,Notting Hill Gate,571,55
3840,3840,Kensington and Chelsea,2021-05-26,Winkworth - Hammersmith,0,"Stonor Road, West Kensington, London W14",0,0,pre-owned,775000.0,flat,0,share_of_freehold,3 bed flat for sale,51.493294,-0.205113,83.0,3,2,1,2021-05-26,775000.0,0,0,0,West Kensington,285,24
3841,3841,Kensington and Chelsea,2021-05-26,Susan Metcalfe Residential,0,"Adrian Mews, London SW10",0,0,pre-owned,1650000.0,Other,0,freehold,3 bed property for sale,51.48509,-0.189175,98.0,3,3,2,2021-05-26,1650000.0,0,1,0,West Brompton,563,23
3842,3842,Kensington and Chelsea,2021-05-26,Knight Frank - Belgravia Sales,0,"Eaton Place, London SW1X",0,0,pre-owned,14750000.0,flat,0,Other,4 bed flat for sale,51.494878,-0.155098,494.0,4,5,2,2021-05-26,14750000.0,0,1,1,Sloane Square,289,46
3843,3843,Kensington and Chelsea,2021-05-25,Savills - Earl's Court,0,"Harrington Gardens, London SW7",0,0,pre-owned,5500000.0,flat,0,share_of_freehold,5 bed flat for sale,51.492242,-0.186413,298.0,5,5,2,2021-05-25,5500000.0,1,0,1,Gloucester Road,492,67
3844,3844,Kensington and Chelsea,2021-05-25,Strutt & Parker - Kensington,0,"Campden Hill Road, Kensington, London W8",0,0,pre-owned,2150000.0,detached,0,freehold,5 bed detached house for sale,51.506538,-0.198613,152.0,5,2,2,2021-05-25,2350000.0,1,0,0,Notting Hill Gate,401,43
3845,3845,Kensington and Chelsea,2021-05-25,Harrods Estates,0,"Park Mansions, 141 Knightsbridge, Knightsbridge, London SW1X",0,0,pre-owned,2350000.0,flat,0,leasehold,2 bed flat for sale,51.501569,-0.161693,88.0,2,2,1,2021-05-25,2350000.0,0,0,0,Knightsbridge,76,67
3846,3846,Kensington and Chelsea,2021-05-25,The Modern House,0,"Russell Gardens Mews, London W14",0,0,pre-owned,4000000.0,mews,0,freehold,4 bed mews house for sale,51.50092,-0.21349,290.0,4,4,0,2021-05-25,4000000.0,0,0,1,Kensington (Olympia),436,16
3847,3847,Kensington and Chelsea,2021-05-25,Domus Nova,0,"Linden Gardens, Notting Hill W2",0,0,pre-owned,3200000.0,flat,0,Other,3 bed flat for sale,51.510965,-0.195315,157.0,3,2,2,2021-05-25,3200000.0,0,0,1,Notting Hill Gate,316,68
3848,3848,Kensington and Chelsea,2021-05-25,Knight Frank - South Kensington Sales,0,"Collingham Gardens, London SW5",0,0,pre-owned,775000.0,flat,0,freehold,1 bed flat for sale,51.4923,-0.1883,69.0,1,1,1,2021-05-25,775000.0,0,0,1,Gloucester Road,458,81
3849,3849,Kensington and Chelsea,2021-05-25,Chestertons - Kensington,0,"Duchess Of Bedford's Walk, Kensington, London W8",0,0,pre-owned,8700000.0,flat,0,leasehold,3 bed flat for sale,51.503161,-0.197637,390.0,3,4,2,2021-05-25,9250000.0,1,1,0,High Street Kensington,405,33
3850,3850,Kensington and Chelsea,2021-05-25,Agent & Homes,0,"Logan Place, London W8",0,0,pre-owned,2800000.0,terraced,0,freehold,4 bed terraced house for sale,51.494823,-0.196972,233.0,4,4,1,2021-05-25,2800000.0,1,1,1,Earl's Court,400,53
3851,3851,Kensington and Chelsea,2021-05-25,John D Wood & Co. - Chelsea Green,0,"Christchurch Street, London SW3",0,0,pre-owned,2950000.0,terraced,0,freehold,3 bed terraced house for sale,51.486314,-0.163376,123.0,3,2,2,2021-05-25,2950000.0,1,0,1,Sloane Square,774,30
3852,3852,Kensington and Chelsea,2021-05-25,The Cloister,0,"Pembroke Road, London W8",0,0,pre-owned,7000000.0,Other,0,freehold,6 bed property for sale,51.495094,-0.197047,465.0,6,5,3,2021-05-25,7000000.0,0,1,1,Earl's Court,407,54
3853,3853,Kensington and Chelsea,2021-05-25,Bective - Ladbroke Grove,0,"Latimer Road, London W10",0,0,pre-owned,575000.0,flat,0,share_of_freehold,2 bed flat for sale,51.517349,-0.223424,56.0,2,1,1,2021-05-25,575000.0,0,0,1,Upminster,574,5
3854,3854,Kensington and Chelsea,2021-05-25,Knightsbridge Estate Agents,0,"Harrington Road, London SW7",0,0,pre-owned,7000000.0,flat,0,Other,3 bed flat for sale,51.493847,-0.176885,433.0,3,4,0,2021-05-25,7000000.0,1,0,0,South Kensington,213,87
3855,3855,Kensington and Chelsea,2021-05-25,Knightsbridge Estate Agents,0,"Knightsbridge, London SW1X",0,0,pre-owned,20000000.0,flat,0,Other,6 bed flat for sale,51.502219,-0.162431,929.0,6,6,0,2021-05-25,20000000.0,1,0,0,Knightsbridge,145,53
3856,3856,Kensington and Chelsea,2021-05-24,Savills - Waterfront,0,"Doulton House, Chelsea Creek, 11 Park Street, Fulham, London SW6",0,0,pre-owned,1095000.0,flat,0,leasehold,3 bed flat for sale,51.475247,-0.18415,95.0,3,2,1,2021-05-24,1095000.0,1,1,1,Fulham Broadway,932,17
3857,3857,Kensington and Chelsea,2021-05-24,Hamptons - Notting Hill Sales,0,"Chesterton Road, London W10",0,0,pre-owned,599950.0,flat,0,leasehold,1 bed flat for sale,51.520617,-0.210545,53.0,1,1,1,2021-05-24,599950.0,0,0,1,Ladbroke Grove,391,37
3858,3858,Kensington and Chelsea,2021-05-24,Fraser & Co - Paddington,1,"Palace Gardens Court, Notting Hill W2",0,0,new,850000.0,flat,0,leasehold,1 bed flat for sale,51.511163,-0.193319,36.0,1,1,1,2021-05-24,850000.0,1,0,0,Notting Hill Gate,313,109
3859,3859,Kensington and Chelsea,2021-05-24,Knight Frank - Notting Hill Sales,0,"Princedale Road, Holland Park, London W11",0,0,pre-owned,1850000.0,maisonette,0,Other,2 bed maisonette for sale,51.509289,-0.211006,121.0,2,2,0,2021-05-24,1950000.0,0,0,0,Holland Park,424,9
3860,3860,Kensington and Chelsea,2021-05-24,Savills - Notting Hill,0,"Ossington Street, London W2",0,0,pre-owned,8950000.0,terraced,0,freehold,5 bed terraced house for sale,51.510465,-0.192564,372.0,5,5,0,2021-05-24,8950000.0,1,1,1,Notting Hill Gate,294,84
3861,3861,Kensington and Chelsea,2021-05-24,Quinta Estates,0,"Redcliffe Square, Kensington, London SW10",0,0,pre-owned,1000000.0,flat,0,share_of_freehold,1 bed flat for sale,51.488622,-0.188953,3.0,1,1,1,2021-05-24,950000.0,1,0,0,West Brompton,488,50
3862,3862,Kensington and Chelsea,2021-05-24,Homesite,0,"Holland Road, Holland Park W14",0,0,pre-owned,740000.0,flat,0,leasehold,1 bed flat for sale,51.5,-0.21,77.0,1,1,1,2021-05-24,725000.0,0,0,1,Kensington (Olympia),328,21
3863,3863,Kensington and Chelsea,2021-05-24,Foxtons - South Kensington,0,"Onslow Court, Drayton Gardens, Chelsea, London SW10",0,0,pre-owned,1600000.0,flat,0,Other,3 bed flat for sale,51.487702,-0.180048,46.0,3,2,1,2021-05-24,1600000.0,0,0,1,Gloucester Road,695,55
